{
  "$schema": "https://json-schema.org/draft/2020-12/schema",
  "$id": "https://miso.ai/theme-base/blueprint.schema.json",
  "title": "Theme Base Blueprint",
  "type": "object",
  "additionalProperties": false,
  "required": ["theme", "presets", "market", "visual", "components", "sections", "templates", "content", "listing", "docs", "qa"],
  "properties": {
    "theme": {
      "type": "object",
      "additionalProperties": false,
      "required": ["name", "handle", "version", "author", "documentationUrl", "supportUrl"],
      "properties": {
        "name": { "type": "string", "minLength": 1, "maxLength": 30 },
        "handle": { "type": "string", "pattern": "^[a-z0-9]+(?:-[a-z0-9]+)*$" },
        "version": { "type": "string", "pattern": "^\\d+\\.\\d+\\.\\d+$" },
        "author": { "type": "string", "minLength": 1 },
        "documentationUrl": { "type": "string", "format": "uri" },
        "supportUrl": { "type": "string", "format": "uri" }
      }
    },
    "presets": {
      "type": "array",
      "minItems": 1,
      "items": {
        "type": "object",
        "additionalProperties": false,
        "required": ["name", "handle", "industries", "catalogSize", "positioning"],
        "properties": {
          "name": { "type": "string", "minLength": 1, "maxLength": 30 },
          "handle": { "type": "string", "pattern": "^[a-z0-9]+(?:-[a-z0-9]+)*$" },
          "industries": {
            "type": "array",
            "minItems": 1,
            "maxItems": 2,
            "items": {
              "enum": ["Art", "Auto", "Bags", "Beauty", "Clothing", "Electronics", "Entertainment", "Food and drink", "Garden", "Hardware", "Home", "Jewelry and accessories", "Kids", "Office", "Pets", "Services", "Shoes", "Sports", "Toys", "Wellness"]
            }
          },
          "catalogSize": { "enum": ["1 product", "Few (2-10)", "Some (11-100+)", "Lots (500+)"] },
          "positioning": { "type": "string", "minLength": 20 }
        }
      }
    },
    "market": {
      "type": "object",
      "additionalProperties": false,
      "required": ["merchantProfile", "productModel", "buyingBehavior", "catalogStrategy"],
      "properties": {
        "merchantProfile": { "type": "string", "minLength": 20 },
        "productModel": { "type": "string", "minLength": 10 },
        "buyingBehavior": { "type": "string", "minLength": 10 },
        "catalogStrategy": { "type": "string", "minLength": 10 }
      }
    },
    "visual": {
      "type": "object",
      "additionalProperties": false,
      "required": ["tokens", "typography", "imagery", "density", "motion"],
      "properties": {
        "tokens": {
          "type": "object",
          "additionalProperties": false,
          "required": ["background", "text", "accent", "surface", "border", "radius"],
          "properties": {
            "background": { "type": "string", "pattern": "^#[0-9A-Fa-f]{6}$" },
            "text": { "type": "string", "pattern": "^#[0-9A-Fa-f]{6}$" },
            "accent": { "type": "string", "pattern": "^#[0-9A-Fa-f]{6}$" },
            "surface": { "type": "string", "pattern": "^#[0-9A-Fa-f]{6}$" },
            "border": { "type": "string", "pattern": "^#[0-9A-Fa-f]{6}$" },
            "radius": { "type": "string", "pattern": "^[0-9]+px$" }
          }
        },
        "typography": { "type": "string", "minLength": 10 },
        "imagery": { "type": "string", "minLength": 10 },
        "density": { "enum": ["compact", "balanced", "spacious"] },
        "motion": { "enum": ["none", "restrained", "expressive"] }
      }
    },
    "components": {
      "type": "array",
      "minItems": 1,
      "items": { "type": "string", "pattern": "^[a-z0-9-]+$" }
    },
    "sections": {
      "type": "array",
      "minItems": 1,
      "items": { "type": "string", "pattern": "^[a-z0-9-]+$" }
    },
    "templates": {
      "type": "array",
      "minItems": 1,
      "items": { "enum": ["index", "product", "collection", "cart", "search", "blog", "article", "page"] }
    },
    "content": {
      "type": "object",
      "additionalProperties": false,
      "required": ["homeHeroHeading", "homeHeroText", "emptyStateText", "newsletterHeading"],
      "properties": {
        "homeHeroHeading": { "type": "string", "minLength": 1 },
        "homeHeroText": { "type": "string", "minLength": 1 },
        "emptyStateText": { "type": "string", "minLength": 1 },
        "newsletterHeading": { "type": "string", "minLength": 1 }
      }
    },
    "listing": {
      "type": "object",
      "additionalProperties": false,
      "required": ["summary", "featureBullets", "screenshotPlan", "releaseNotes"],
      "properties": {
        "summary": { "type": "string", "minLength": 40 },
        "featureBullets": { "type": "array", "minItems": 3, "items": { "type": "string", "minLength": 10 } },
        "screenshotPlan": { "type": "string", "minLength": 20 },
        "releaseNotes": { "type": "array", "minItems": 1, "items": { "type": "string", "minLength": 10 } }
      }
    },
    "docs": {
      "type": "object",
      "additionalProperties": false,
      "required": ["merchantTopics", "aiNotes"],
      "properties": {
        "merchantTopics": { "type": "array", "minItems": 1, "items": { "type": "string", "minLength": 5 } },
        "aiNotes": { "type": "array", "minItems": 1, "items": { "type": "string", "minLength": 5 } }
      }
    },
    "qa": {
      "type": "object",
      "additionalProperties": false,
      "required": ["scenarios", "lighthouse"],
      "properties": {
        "scenarios": { "type": "array", "minItems": 1, "items": { "type": "string", "minLength": 5 } },
        "lighthouse": {
          "type": "object",
          "additionalProperties": false,
          "required": ["performance", "accessibility"],
          "properties": {
            "performance": { "type": "integer", "minimum": 60 },
            "accessibility": { "type": "integer", "minimum": 90 }
          }
        }
      }
    }
  }
}
